{
  "disclaimer": "Usage subject to terms: https://openexchangerates.org/terms",
  "license": "https://openexchangerates.org/license",
  "timestamp": 1686614400,
  "base": "USD",
  "rates": {
    "AED": 3.673098,
    "AFN": 88.5001,
    "ALL": 107.55,
    "AMD": 386.85,
    "ANG": 1.800234,
    "AOA": 828.506,
    "ARS": 251.07,
    "AUD": 1.496012,
    "AWG": 1.8,
    "AZN": 1.7,
    "BAM": 1.807949,
    "BBD": 2,
    "BDT": 107.8,
    "BGN": 1.808569,
    "BHD": 0.37699,
    "BIF": 2836.45,
    "BMD": 1,
    "BND": 1.33985,
    "BOB": 6.909624,
    "BRL": 4.924901,
    "BSD": 1,
    "BTC": 0.000036,
    "BTN": 82.37,
    "BWP": 13.455,
    "BYN": 2.5238,
    "BZD": 2.016524,
    "CAD": 1.330123,
    "CDF": 2560,
    "CHF": 0.904124,
    "CLF": 0.030619,
    "CLP": 843.99,
    "CNY": 7.1303,
    "COP": 4484.09,
    "CRC": 531.558065,
    "CUC": 1,
    "CUP": 24,
    "CVE": 102.35,
    "CZK": 21.918,
    "DJF": 177.72,
    "DKK": 6.882499,
    "DOP": 56.65,
    "DZD": 135.155,
    "EGP": 30.8995,
    "ERN": 15,
    "ETB": 54.75,
    "EUR": 0.924123,
    "FJD": 2.2162,
    "FKP": 0.787456,
    "GBP": 0.787456,
    "GEL": 2.615,
    "GHS": 11.47,
    "GIP": 0.787456,
    "GMD": 62.5,
    "HKD": 7.8293,
    "HUF": 345.42,
    "IDR": 14945,
    "ILS": 3.659,
    "INR": 82.37,
    "IQD": 1309.5,
    "IRR": 42250,
    "ISK": 137.09,
    "JMD": 155.42,
    "JOD": 0.709,
    "JPY": 139.825,
    "KES": 139.45,
    "KGS": 87.44,
    "KHR": 4113,
    "KMF": 454.07,
    "KRW": 1299.71,
    "KWD": 0.306949,
    "KYD": 0.833393,
    "KZT": 447.98,
    "LAK": 19965,
    "LBP": 15035,
    "LKR": 320.28,
    "LRD": 187.5,
    "LSL": 18.37,
    "LYD": 4.804,
    "MAD": 10.065,
    "MDL": 17.81,
    "MGA": 4465,
    "MKD": 56.97,
    "MMK": 2099.5,
    "MNT": 3470,
    "MOP": 8.077,
    "MRU": 38.1,
    "MUR": 44.61,
    "MVR": 15.4,
    "MWK": 1022,
    "MXN": 17.1645,
    "MYR": 4.623,
    "MZN": 63.45,
    "NAD": 18.37,
    "NGN": 770.5,
    "NIO": 36.57,
    "NOK": 10.6481,
    "NPR": 131.8,
    "NZD": 1.617298,
    "OMR": 0.384985,
    "PAB": 1,
    "PEN": 3.693,
    "PGK": 3.565,
    "PHP": 55.96,
    "PKR": 287.88,
    "PLN": 4.156401,
    "PYG": 7278,
    "QAR": 3.641,
    "RON": 4.5887,
    "RSD": 108.44,
    "RUB": 84.15,
    "RWF": 1145,
    "SAR": 3.7503,
    "SBD": 8.3898,
    "SCR": 13.685,
    "SDG": 601,
    "SEK": 10.7619,
    "SGD": 1.33985,
    "SHP": 0.787456,
    "SLL": 22750,
    "SOS": 569,
    "SRD": 38.42,
    "STD": 22281,
    "SVC": 8.750025,
    "SYP": 2512.5,
    "SZL": 18.37,
    "THB": 34.92,
    "TJS": 10.899,
    "TMT": 3.51,
    "TND": 3.094,
    "TOP": 2.3395,
    "TRY": 23.6855,
    "TTD": 6.791005,
    "TWD": 30.7,
    "TZS": 2384,
    "UAH": 36.93,
    "UGX": 3762,
    "USD": 1,
    "UYU": 38.735,
    "UZS": 11555,
    "VES": 29.89,
    "VND": 23470,
    "VUV": 118.73,
    "WST": 2.716,
    "XAF": 606.36,
    "XCD": 2.70255,
    "XDR": 0.748892,
    "XOF": 606.36,
    "XPF": 110.28,
    "YER": 250.35,
    "ZAR": 18.37,
    "ZMW": 20.52,
    "ZWL": 322
  }
}
